{
  "$schema": "http://json-schema.org/draft-07/schema#",
  "title": "boring.json",
  "type": "object",
  "required": ["schema_version"],
  "properties": {
    "schema_version": {
      "type": "integer",
      "minimum": 1,
      "description": "Schema version. Higher versions are loaded with a warning."
    },
    "note_lang": {
      "type": "string",
      "enum": ["auto", "ko", "en"],
      "default": "auto",
      "description": "Output language for distilled notes (ko/en/auto)."
    },
    "card": {
      "type": "object",
      "additionalProperties": false,
      "description": "Morning card display settings.",
      "properties": {
        "note_links": {
          "type": "object",
          "additionalProperties": false,
          "description": "Links shown beside a note id on the card, in this order. Leave out a key to hide that link.",
          "properties": {
            "obsidian": {
              "type": "object",
              "additionalProperties": false,
              "required": ["vault"],
              "properties": {
                "vault": {"type": "string", "description": "Obsidian vault name (as Obsidian lists it)."},
                "folder": {"type": "string", "description": "Notes folder inside the vault, e.g. vault/wiki."}
              }
            },
            "file": {
              "type": "object",
              "additionalProperties": false,
              "required": ["folder"],
              "properties": {
                "folder": {"type": "string", "pattern": "^/", "description": "Absolute host path of the notes folder — no ~ (the card runs in the door container, whose ~ is not yours)."},
                "editor": {"type": "string", "pattern": "^[a-z][a-z0-9+.-]*$", "default": "vscode", "description": "Editor URL scheme that opens the file: vscode, cursor, zed (Slack does not link file://)."}
              }
            }
          }
        }
      }
    },
    "llm": {
      "type": "object",
      "description": "LLM connection + bootstrap policy (v2). The engine is OpenAI-compatible and backend-agnostic; `provider` steers only the host-side bootstrap (model pull / daemon ensure / health probe). Runtime env (BORING_LLM_*) still overrides.",
      "properties": {
        "provider": {
          "type": "string",
          "enum": ["ollama", "lmstudio", "openai-compatible"],
          "default": "ollama",
          "description": "ollama = ensure serve + pull models. lmstudio = OpenAI /v1, models loaded via its UI/`lms` (no pull). openai-compatible = vLLM/llama.cpp/remote OpenAI (no pull)."
        },
        "base_url": {
          "type": "string",
          "default": "http://host.docker.internal:11434/v1",
          "description": "OpenAI-compatible base URL. LM Studio is usually http://localhost:1234/v1."
        },
        "model": {
          "type": "string",
          "default": "gemma4:12b",
          "description": "Chat/synthesis model — used only by the ask/brief generation path."
        },
        "embed_model": {
          "type": "string",
          "default": "bge-m3",
          "description": "Embedding model — the only model drudge itself calls (kernel A). Authoritative when set."
        },
        "embed_dim": {
          "type": "integer",
          "minimum": 1,
          "default": 1024,
          "description": "Embedding dimension. MUST match embed_model's output (bge-m3=1024, nomic-embed-text=768, OpenAI 3-small=1536). Changing it needs `make reset` (vectors are reshaped)."
        },
        "api_key_env": {
          "type": "string",
          "default": "BORING_LLM_API_KEY",
          "description": "Name of the env var holding the API key (providers that need auth). The key itself never lives in boring.json."
        },
        "bootstrap": {
          "type": "string",
          "enum": ["auto", "manual"],
          "default": "auto",
          "description": "auto = bootstrap may start a daemon / pull models. manual = health-check only, never serve/pull (user owns the server, e.g. LM Studio)."
        }
      },
      "additionalProperties": false
    },
    "embed_model": {
      "type": "string",
      "default": "bge-m3",
      "description": "DEPRECATED (v1) — use llm.embed_model. Still honored as a fallback when llm.embed_model is unset."
    },
    "embed_dim": {
      "type": "integer",
      "minimum": 1,
      "default": 1024,
      "description": "DEPRECATED (v1) — use llm.embed_dim. Still honored as a fallback when llm.embed_dim is unset."
    },
    "checkout_roots": {
      "type": "array",
      "items": { "type": "string" },
      "description": "Directories (~ expanded, depth ≤ 3) holding your git checkouts. The nightly hygiene pass reports projects named after a checkout folder instead of its remote repo. Unset = the check is not run (reported as not scanned, never as zero)."
    },
    "allow_company_origin": {
      "type": "boolean",
      "default": false,
      "description": "When true, origin:company notes (session experience from company work) are accepted corpus and do not flip the audit 'clean' flag. Default false flags them for review. Governs session experience only — company KB originals stay off-policy."
    },
    "repos": {
      "type": "array",
      "default": [],
      "items": {
        "type": "object",
        "required": ["match", "origin"],
        "properties": {
          "match": {
            "type": "string",
            "description": "Case-insensitive substring matched against git remote URL first, then cwd."
          },
          "origin": {
            "type": "string",
            "enum": ["personal", "company", "mirror", "community"]
          },
          "name": {
            "type": "string",
            "description": "Optional repo slug override."
          }
        },
        "additionalProperties": false
      }
    },
    "code_index": {
      "type": "object",
      "default": {"sources": []},
      "description": "Explicit source-code corpus. This is separate from repos, which classifies memory origin.",
      "properties": {
        "sources": {
          "type": "array",
          "default": [],
          "items": {
            "type": "object",
            "required": ["id", "name", "root", "language"],
            "properties": {
              "id": {"type": "string", "minLength": 1, "description": "Stable repository persistence id."},
              "name": {"type": "string", "minLength": 1, "description": "Stable human-facing repository name."},
              "root": {"type": "string", "minLength": 1, "description": "Repository root path."},
              "language": {"type": "string", "enum": ["rust", "python", "shell"]},
              "enabled": {"type": "boolean", "default": false}
            },
            "additionalProperties": false
          }
        }
      },
      "additionalProperties": false
    },
    "hermes_cron_jobs": {
      "type": "object",
      "default": {
        "morning-card": {
          "enabled": true,
          "schedule": "0 8 * * *",
          "script": "run-morning-card.py",
          "deliver": "local"
        },
        "weekly-card": {
          "enabled": true,
          "schedule": "0 9 * * 1",
          "script": "run-weekly-card.py",
          "deliver": "local"
        },
        "weekly-briefing": {
          "enabled": false,
          "schedule": "0 9 * * 1",
          "script": "weekly-briefing.py"
        }
      },
      "description": "Managed hermes-agent cron jobs keyed by job name. Jobs not listed here are left untouched. An empty object disables managed jobs.",
      "patternProperties": {
        "^[a-z0-9-]+$": {
          "type": "object",
          "required": ["enabled", "schedule", "script"],
          "properties": {
            "enabled": { "type": "boolean", "default": true },
            "schedule": {
              "type": "string",
              "default": "0 9 * * 1",
              "description": "Cron expression (minute hour dom mon dow). Currently only '* *' dom/mon and specific dow are fully supported."
            },
            "script": {
              "type": "string",
              "default": "weekly-briefing.py",
              "description": "Script name under ~/.hermes/scripts/."
            },
            "deliver": {
              "type": "string",
              "default": "local",
              "description": "hermes delivery target. Use 'local' for jobs whose script already delivers itself (the card scripts post to Slack through the door) — hermes would only re-wrap the output."
            }
          },
          "additionalProperties": false
        }
      },
      "additionalProperties": false
    },
    "agents": {
      "type": "array",
      "default": [],
      "items": {
        "type": "object",
        "required": ["id", "enabled"],
        "properties": {
          "id": {
            "type": "string",
            "enum": [
              "claude-code",
              "cursor",
              "codex",
              "windsurf",
              "claude-desktop",
              "hermes-agent"
            ]
          },
          "enabled": { "type": "boolean", "default": true },
          "format": { "type": "string" },
          "paths": {
            "type": "array",
            "items": { "type": "string" }
          },
          "settings_path": {
            "type": "string",
            "description": "Optional agent settings file path override (e.g. MCP config or Claude Code settings.json). ~ expansion supported."
          },
          "adapter": {
            "type": "string",
            "enum": ["session-end", "prompt-submit", "mcp-only", "cron"],
            "description": "How this agent is wired. Inferred when omitted."
          }
        },
        "additionalProperties": false
      }
    }
  },
  "additionalProperties": false
}
