{
  "$schema": "https://raw.githubusercontent.com/jazz1x/ohmyboring/main/boring.schema.json",
  "schema_version": 2,
  "note_lang": "auto",
  "card": {
    "note_links": {
      "obsidian": {"vault": "my-vault", "folder": "vault/wiki"},
      "file": {"folder": "/Users/you/src/oh-my-boring/vault/wiki", "editor": "vscode"}
    }
  },
  "checkout_roots": ["~/src"],
  "llm": {
    "provider": "ollama",
    "base_url": "http://host.docker.internal:11434/v1",
    "model": "qwen3:14b",
    "embed_model": "bge-m3",
    "embed_dim": 1024,
    "api_key_env": "BORING_LLM_API_KEY",
    "bootstrap": "auto"
  },
  "repos": [
    {"match": "your-company", "origin": "company", "name": "work"},
    {"match": "your-name/code", "origin": "personal", "name": "personal"}
  ],
  "code_index": {
    "sources": [
      {
        "id": "oh-my-boring",
        "name": "oh-my-boring",
        "root": "/absolute/path/to/oh-my-boring",
        "language": "rust",
        "enabled": false
      }
    ]
  },
  "agents": [
    {
      "id": "claude-code",
      "enabled": true,
      "adapter": "session-end",
      "format": "claude-json",
      "paths": ["~/.claude/projects"]
    },
    {
      "id": "cursor",
      "enabled": true,
      "adapter": "mcp-only"
    },
    {
      "id": "codex",
      "enabled": true,
      "adapter": "mcp-only"
    }
  ]
}
